{
  "$schema": "https://json-schema.org/draft/2020-12/schema",
  "title": "IPD Project Report 1.0",
  "type": "object",
  "properties": {
    "schemaVersion": {
      "type": "string",
      "const": "1.0"
    },
    "reviewStatus": {
      "type": "string",
      "enum": [
        "draft",
        "reviewed"
      ]
    },
    "isDemo": {
      "type": "boolean"
    },
    "project": {
      "type": "object",
      "properties": {
        "id": {
          "type": "string",
          "pattern": "^[a-z0-9][a-z0-9_-]{0,63}$"
        },
        "name": {
          "type": "string",
          "minLength": 1,
          "maxLength": 80,
          "pattern": "\\S"
        },
        "startDate": {
          "type": [
            "string",
            "null"
          ],
          "format": "date"
        },
        "stage": {
          "type": [
            "string",
            "null"
          ],
          "minLength": 1,
          "maxLength": 60,
          "pattern": "\\S"
        }
      },
      "required": [
        "id",
        "name",
        "startDate",
        "stage"
      ],
      "additionalProperties": false
    },
    "study": {
      "type": "object",
      "properties": {
        "title": {
          "type": "string",
          "minLength": 1,
          "maxLength": 200,
          "pattern": "\\S"
        },
        "reportDate": {
          "type": [
            "string",
            "null"
          ],
          "format": "date"
        },
        "sampleSize": {
          "type": [
            "integer",
            "null"
          ],
          "minimum": 1
        },
        "method": {
          "type": [
            "string",
            "null"
          ],
          "minLength": 1,
          "maxLength": 4000,
          "pattern": "\\S"
        },
        "evidenceRefs": {
          "type": "array",
          "items": {
            "type": "string",
            "minLength": 1,
            "maxLength": 120,
            "pattern": "\\S"
          },
          "maxItems": 100,
          "uniqueItems": true
        }
      },
      "required": [
        "title",
        "reportDate",
        "sampleSize",
        "method",
        "evidenceRefs"
      ],
      "additionalProperties": false
    },
    "sources": {
      "type": "array",
      "items": {
        "$ref": "#/$defs/source"
      },
      "minItems": 1,
      "maxItems": 200
    },
    "evidence": {
      "type": "array",
      "items": {
        "$ref": "#/$defs/evidence"
      },
      "minItems": 0,
      "maxItems": 10000
    },
    "dimensions": {
      "type": "array",
      "items": {
        "$ref": "#/$defs/dimension"
      },
      "minItems": 6,
      "maxItems": 6
    },
    "cases": {
      "type": "array",
      "items": {
        "$ref": "#/$defs/case"
      },
      "minItems": 0,
      "maxItems": 2000
    },
    "issues": {
      "type": "array",
      "items": {
        "$ref": "#/$defs/issue"
      },
      "minItems": 0,
      "maxItems": 20000
    },
    "openQuestions": {
      "type": "array",
      "items": {
        "$ref": "#/$defs/question"
      },
      "minItems": 0,
      "maxItems": 1000
    }
  },
  "required": [
    "schemaVersion",
    "reviewStatus",
    "isDemo",
    "project",
    "study",
    "sources",
    "evidence",
    "dimensions",
    "cases",
    "issues",
    "openQuestions"
  ],
  "additionalProperties": false,
  "$defs": {
    "source": {
      "type": "object",
      "properties": {
        "id": {
          "type": "string",
          "minLength": 1,
          "maxLength": 120,
          "pattern": "\\S"
        },
        "title": {
          "type": "string",
          "minLength": 1,
          "maxLength": 300,
          "pattern": "\\S"
        },
        "type": {
          "type": "string",
          "enum": [
            "ipd_report",
            "development_issues",
            "other"
          ]
        }
      },
      "required": [
        "id",
        "title",
        "type"
      ],
      "additionalProperties": false
    },
    "evidence": {
      "type": "object",
      "properties": {
        "id": {
          "type": "string",
          "minLength": 1,
          "maxLength": 120,
          "pattern": "\\S"
        },
        "sourceId": {
          "type": "string",
          "minLength": 1,
          "maxLength": 120,
          "pattern": "\\S"
        },
        "location": {
          "type": "string",
          "minLength": 1,
          "maxLength": 300,
          "pattern": "\\S"
        },
        "excerpt": {
          "type": "string",
          "minLength": 1,
          "maxLength": 600,
          "pattern": "\\S"
        }
      },
      "required": [
        "id",
        "sourceId",
        "location",
        "excerpt"
      ],
      "additionalProperties": false
    },
    "dimension": {
      "type": "object",
      "properties": {
        "id": {
          "type": "string",
          "enum": [
            "novelty",
            "goals",
            "growth",
            "fun",
            "social",
            "time_cost"
          ]
        },
        "name": {
          "type": "string",
          "minLength": 1,
          "maxLength": 30,
          "pattern": "\\S"
        },
        "summary": {
          "type": [
            "object",
            "null"
          ],
          "properties": {
            "text": {
              "type": "string",
              "minLength": 1,
              "maxLength": 4000,
              "pattern": "\\S"
            },
            "evidenceRefs": {
              "type": "array",
              "items": {
                "type": "string",
                "minLength": 1,
                "maxLength": 120,
                "pattern": "\\S"
              },
              "minItems": 0,
              "maxItems": 100,
              "uniqueItems": true
            }
          },
          "required": [
            "text",
            "evidenceRefs"
          ],
          "additionalProperties": false
        },
        "metrics": {
          "type": "array",
          "items": {
            "type": "object",
            "properties": {
              "id": {
                "type": "string",
                "minLength": 1,
                "maxLength": 120,
                "pattern": "\\S"
              },
              "name": {
                "type": "string",
                "minLength": 1,
                "maxLength": 80,
                "pattern": "\\S"
              },
              "value": {
                "type": [
                  "number",
                  "null"
                ]
              },
              "unit": {
                "type": "string",
                "enum": [
                  "percent",
                  "score",
                  "count",
                  "minutes",
                  "ratio"
                ]
              },
              "scale": {
                "type": [
                  "object",
                  "null"
                ],
                "properties": {
                  "min": {
                    "type": "number"
                  },
                  "max": {
                    "type": "number"
                  }
                },
                "required": [
                  "min",
                  "max"
                ],
                "additionalProperties": false
              },
              "higherIsBetter": {
                "type": [
                  "boolean",
                  "null"
                ]
              },
              "sampleSize": {
                "type": [
                  "integer",
                  "null"
                ],
                "minimum": 1
              },
              "evidenceRefs": {
                "type": "array",
                "items": {
                  "type": "string",
                  "minLength": 1,
                  "maxLength": 120,
                  "pattern": "\\S"
                },
                "minItems": 0,
                "maxItems": 100,
                "uniqueItems": true
              },
              "note": {
                "type": [
                  "string",
                  "null"
                ],
                "minLength": 1,
                "maxLength": 4000,
                "pattern": "\\S"
              }
            },
            "required": [
              "id",
              "name",
              "value",
              "unit",
              "scale",
              "higherIsBetter",
              "sampleSize",
              "evidenceRefs",
              "note"
            ],
            "additionalProperties": false
          },
          "minItems": 0,
          "maxItems": 20
        }
      },
      "required": [
        "id",
        "name",
        "summary",
        "metrics"
      ],
      "additionalProperties": false
    },
    "case": {
      "type": "object",
      "properties": {
        "id": {
          "type": "string",
          "minLength": 1,
          "maxLength": 120,
          "pattern": "\\S"
        },
        "title": {
          "type": "string",
          "minLength": 1,
          "maxLength": 200,
          "pattern": "\\S"
        },
        "dimensionIds": {
          "type": "array",
          "items": {
            "type": "string",
            "minLength": 1,
            "maxLength": 120,
            "pattern": "\\S"
          },
          "minItems": 0,
          "maxItems": 100,
          "uniqueItems": true
        },
        "kind": {
          "type": "string",
          "enum": [
            "strength",
            "problem",
            "observation"
          ]
        },
        "observation": {
          "type": "string",
          "minLength": 1,
          "maxLength": 4000,
          "pattern": "\\S"
        },
        "analysis": {
          "type": [
            "object",
            "null"
          ],
          "properties": {
            "text": {
              "type": "string",
              "minLength": 1,
              "maxLength": 4000,
              "pattern": "\\S"
            },
            "origin": {
              "type": "string",
              "enum": [
                "source",
                "ai"
              ]
            },
            "evidenceRefs": {
              "type": "array",
              "items": {
                "type": "string",
                "minLength": 1,
                "maxLength": 120,
                "pattern": "\\S"
              },
              "minItems": 0,
              "maxItems": 100,
              "uniqueItems": true
            }
          },
          "required": [
            "text",
            "origin",
            "evidenceRefs"
          ],
          "additionalProperties": false
        },
        "suggestion": {
          "type": [
            "object",
            "null"
          ],
          "properties": {
            "text": {
              "type": "string",
              "minLength": 1,
              "maxLength": 4000,
              "pattern": "\\S"
            },
            "origin": {
              "type": "string",
              "enum": [
                "source",
                "ai"
              ]
            },
            "evidenceRefs": {
              "type": "array",
              "items": {
                "type": "string",
                "minLength": 1,
                "maxLength": 120,
                "pattern": "\\S"
              },
              "minItems": 0,
              "maxItems": 100,
              "uniqueItems": true
            }
          },
          "required": [
            "text",
            "origin",
            "evidenceRefs"
          ],
          "additionalProperties": false
        },
        "evidenceRefs": {
          "type": "array",
          "items": {
            "type": "string",
            "minLength": 1,
            "maxLength": 120,
            "pattern": "\\S"
          },
          "minItems": 0,
          "maxItems": 100,
          "uniqueItems": true
        },
        "issueIds": {
          "type": "array",
          "items": {
            "type": "string",
            "minLength": 1,
            "maxLength": 120,
            "pattern": "\\S"
          },
          "minItems": 0,
          "maxItems": 100,
          "uniqueItems": true
        }
      },
      "required": [
        "id",
        "title",
        "dimensionIds",
        "kind",
        "observation",
        "analysis",
        "suggestion",
        "evidenceRefs",
        "issueIds"
      ],
      "additionalProperties": false
    },
    "issue": {
      "type": "object",
      "properties": {
        "id": {
          "type": "string",
          "minLength": 1,
          "maxLength": 120,
          "pattern": "\\S"
        },
        "title": {
          "type": "string",
          "minLength": 1,
          "maxLength": 4000,
          "pattern": "\\S"
        },
        "owner": {
          "type": [
            "string",
            "null"
          ],
          "minLength": 1,
          "maxLength": 120,
          "pattern": "\\S"
        },
        "status": {
          "type": "string",
          "enum": [
            "未解决",
            "进行中",
            "待验证",
            "已解决",
            "未标注"
          ]
        },
        "priority": {
          "type": [
            "string",
            "null"
          ],
          "minLength": 1,
          "maxLength": 50,
          "pattern": "\\S"
        },
        "category": {
          "type": [
            "string",
            "null"
          ],
          "minLength": 1,
          "maxLength": 100,
          "pattern": "\\S"
        },
        "date": {
          "type": [
            "string",
            "null"
          ],
          "format": "date"
        },
        "resolvedAt": {
          "type": [
            "string",
            "null"
          ],
          "format": "date"
        },
        "solution": {
          "type": [
            "string",
            "null"
          ],
          "minLength": 1,
          "maxLength": 4000,
          "pattern": "\\S"
        },
        "version": {
          "type": [
            "string",
            "null"
          ],
          "minLength": 1,
          "maxLength": 80,
          "pattern": "\\S"
        },
        "dimensionIds": {
          "type": "array",
          "items": {
            "type": "string",
            "minLength": 1,
            "maxLength": 120,
            "pattern": "\\S"
          },
          "minItems": 0,
          "maxItems": 100,
          "uniqueItems": true
        },
        "evidenceRefs": {
          "type": "array",
          "items": {
            "type": "string",
            "minLength": 1,
            "maxLength": 120,
            "pattern": "\\S"
          },
          "minItems": 0,
          "maxItems": 100,
          "uniqueItems": true
        }
      },
      "required": [
        "id",
        "title",
        "owner",
        "status",
        "priority",
        "category",
        "date",
        "resolvedAt",
        "solution",
        "version",
        "dimensionIds",
        "evidenceRefs"
      ],
      "additionalProperties": false
    },
    "question": {
      "type": "object",
      "properties": {
        "id": {
          "type": "string",
          "minLength": 1,
          "maxLength": 120,
          "pattern": "\\S"
        },
        "question": {
          "type": "string",
          "minLength": 1,
          "maxLength": 4000,
          "pattern": "\\S"
        },
        "reason": {
          "type": "string",
          "minLength": 1,
          "maxLength": 4000,
          "pattern": "\\S"
        },
        "sourceIds": {
          "type": "array",
          "items": {
            "type": "string",
            "minLength": 1,
            "maxLength": 120,
            "pattern": "\\S"
          },
          "minItems": 0,
          "maxItems": 100,
          "uniqueItems": true
        }
      },
      "required": [
        "id",
        "question",
        "reason",
        "sourceIds"
      ],
      "additionalProperties": false
    }
  }
}
